{
  "sic_version": "3.0",
  "task": {
    "id": "A-1",
    "title": "Test empty deliverable",
    "deliverable": "",
    "status": "pending",
    "created_round": 1,
    "owner": null,
    "priority": null
  },
  "round": 1,
  "entity": { "name": "test", "model": "test" },
  "state": {
    "context": "Testing empty deliverable rejection",
    "current_action": "should fail"
  },
  "relation": { "user": "安安" },
  "event": null,
  "intent": null
}
