{
  "sic_version": "3.0",
  "task": {
    "id": "FS-B-1",
    "title": "sic-js-validator-cli 實作",
    "deliverable": "CLI tool that validates SIC-JS records",
    "status": "in_progress",
    "created_round": 1,
    "owner": "咩咩",
    "priority": "P0"
  },
  "round": 3,
  "entity": { "name": "咩咩", "model": "Manus" },
  "state": {
    "context": "Session terminated unexpectedly",
    "current_action": null
  },
  "relation": { "user": "安安" },
  "event": null,
  "intent": null
}
